{
  "version": 6,
  "ships": [
    [
      85,
      90,
      70,
      50,
      13,
      3,
      10
    ],
    [
      65,
      65,
      100,
      65,
      12,
      5,
      15
    ],
    [
      110,
      80,
      130,
      100,
      24,
      8,
      20
    ],
    [
      60,
      40,
      220,
      140,
      18,
      11,
      100
    ],
    [
      45,
      25,
      400,
      200,
      30,
      16,
      200
    ],
    [
      55,
      30,
      320,
      180,
      25,
      14,
      150
    ],
    [
      130,
      110,
      110,
      100,
      28,
      5,
      0
    ],
    [
      115,
      95,
      100,
      70,
      25,
      7,
      10
    ],
    [
      95,
      100,
      90,
      80,
      18,
      6,
      10
    ],
    [
      120,
      85,
      150,
      110,
      26,
      8,
      20
    ],
    [
      45,
      75,
      45,
      20,
      8,
      3,
      5
    ],
    [
      20,
      30,
      35,
      10,
      0,
      3,
      0
    ],
    [
      100,
      120,
      160,
      130,
      32,
      7,
      0
    ]
  ],
  "commodity_base": [
    8,
    10,
    18,
    14,
    30,
    62,
    10,
    15,
    15,
    40,
    20,
    50,
    30,
    40,
    50,
    20
  ],
  "economy_slope": [
    -1,
    -1,
    1,
    -1,
    1,
    -1,
    2,
    1,
    1,
    1,
    -1,
    -1,
    1,
    1,
    1,
    0
  ],
  "equipment_cost": [
    5000,
    300,
    42000,
    0,
    22000,
    4000,
    5000,
    3000
  ],
  "laser_dps": 120,
  "laser_range": 650,
  "cooling": 22,
  "fuel_price": 12,
  "repair_price": 8,
  "npc_damage": 5,
  "shipyard": {
    "version": 1,
    "trade_percent": 60,
    "insurance_percent": 5,
    "hulls": [
      [
        8000,
        5,
        1,
        1,
        1,
        1,
        255,
        100,
        "Small, nimble and easy to keep flying."
      ],
      [
        18000,
        6,
        2,
        1,
        2,
        2,
        255,
        85,
        "A steady first step into hauling."
      ],
      [
        45000,
        7,
        4,
        2,
        4,
        4,
        255,
        75,
        "A versatile home among the stars."
      ],
      [
        110000,
        9,
        4,
        2,
        12,
        5,
        255,
        65,
        "Room for freight and paying guests."
      ],
      [
        380000,
        12,
        6,
        2,
        32,
        9,
        252,
        45,
        "Vast holds for long commercial runs."
      ],
      [
        240000,
        10,
        6,
        2,
        24,
        8,
        254,
        55,
        "An armoured home for heavy freight."
      ],
      [
        150000,
        6,
        4,
        2,
        0,
        9,
        224,
        70,
        "An orderly port military interceptor."
      ],
      [
        80000,
        6,
        3,
        2,
        1,
        4,
        3,
        80,
        "Fast and fragile; a pirate's favourite."
      ],
      [
        180000,
        8,
        2,
        1,
        6,
        6,
        255,
        65,
        "A balanced hull for remote passages."
      ],
      [
        200000,
        10,
        6,
        2,
        2,
        10,
        192,
        60,
        "Military reach with a durable hull."
      ],
      [
        5000,
        4,
        0,
        1,
        0,
        1,
        255,
        60,
        "Tiny, cheap and happiest close to port."
      ]
    ]
  },
  "combat": {
    "damage": [
      [
        1.2,
        0.8
      ],
      [
        0.6,
        1.3
      ],
      [
        0.4,
        1.6
      ]
    ],
    "weapons": [
      [
        14.4,
        0.12,
        4,
        3,
        0,
        0,
        0,
        5000,
        1,
        0
      ],
      [
        9,
        0.04,
        1.8,
        1.5,
        0,
        0,
        0,
        14000,
        5,
        0
      ],
      [
        7,
        0.1,
        1,
        0.8,
        600,
        3,
        400,
        9000,
        3,
        1
      ],
      [
        75,
        1,
        22,
        28,
        1200,
        3,
        0,
        22000,
        7,
        1
      ],
      [
        120,
        1.5,
        10,
        15,
        180,
        12,
        0,
        12000,
        4,
        1
      ],
      [
        120,
        1,
        8,
        12,
        200,
        8,
        0,
        6000,
        2,
        1
      ]
    ],
    "distributor": [
      0.5,
      0.25,
      0.1,
      0.1,
      0.08,
      0.5,
      0.25,
      0,
      3.5
    ],
    "defence": [
      8,
      0.5,
      35,
      2,
      10,
      1.8,
      25,
      5,
      90,
      300,
      8,
      2,
      2,
      2.5,
      900,
      2,
      0.8,
      0.4,
      1.5
    ],
    "supplies": [
      3,
      6,
      4
    ],
    "supply_price": [
      500,
      100,
      150
    ],
    "npc_weapons": [
      [
        0,
        2,
        0,
        2
      ],
      [
        1,
        1,
        1,
        1
      ],
      [
        3,
        4,
        255,
        255
      ]
    ]
  },
  "reverse": 0.35,
  "aim_assist_deg": [
    0,
    4,
    12
  ],
  "weapons_cool_s": 2.0,
  "gimbal_deg": 10,
  "turret_deg": 85,
  "turret_rate_dps": 120,
  "mount_damage": [
    1,
    0.85,
    0.6
  ],
  "mount_price": [
    1,
    1.6,
    2.8
  ]
}
